<?xml version="1.0" encoding="utf-8"?>
<auto-account xmlns:xsi="http://www.w3.org/2001/XMLSchema-instance" xsi:noNamespaceSchemaLocation="AutoAccount.xsd">

<user-account default="true">
	<server></server>
	<user-id></user-id>
	<remember-password>false</remember-password>
	<prompt-to-accept-cert>false</prompt-to-accept-cert>
	<default-ifolder default="true">
		<path></path>
		<encrypted>false</encrypted>
		<securesync>false</securesync>
		<forcemerge>false</forcemerge>
	</default-ifolder>
</user-account>

<general-preferences>
	<iFolder-creation-confirmation>true</iFolder-creation-confirmation>
	<iFolder-share-notify>true</iFolder-share-notify>
	<user-join-notify>true</user-join-notify>
	<conflict-notify>true</conflict-notify>
	<auto-sync interval="300" duration="seconds">true</auto-sync>
</general-preferences>
</auto-account>
